{
  "$schema": "../../workers/cms-admin/src/schemas/concept-mapping-schema.json",
  "license_id": "Unlicense",
  "version": "1.0.0",
  "last_updated": "2026-04-05T00:00:00Z",
  "generation_method": "manual",
  "human_reviewed": true,
  "concepts": [
    {
      "id": "public-domain-release",
      "original": "This is free and unencumbered software released into the public domain.",
      "plain": ["The person who created the work has given up their copyright."]
    },
    {
      "id": "free-to-copy",
      "original": "copy",
      "plain": ["Copy the work"]
    },
    {
      "id": "free-to-modify",
      "original": "modify",
      "plain": ["Change the work"]
    },
    {
      "id": "free-to-publish",
      "original": "publish",
      "plain": ["Share the work"]
    },
    {
      "id": "free-to-use",
      "original": "use",
      "plain": ["Use the work for any reason"]
    },
    {
      "id": "free-to-sell",
      "original": "sell, or\ndistribute this software",
      "plain": ["Sell the work"]
    },
    {
      "id": "source-or-binary",
      "original": "either in source code form or as a compiled\nbinary",
      "plain": ["Mix the work with other materials"]
    },
    {
      "id": "any-purpose",
      "original": "for any purpose, commercial or non-commercial, and by any\nmeans.",
      "plain": ["You can do all of these things for free. You don't have to follow any rules or include any notices."]
    },
    {
      "id": "copyright-dedication",
      "original": "the author or authors\nof this software dedicate any and all copyright interest in the\nsoftware to the public domain.",
      "plain": ["we give up all our rights to the work."]
    },
    {
      "id": "benefit-of-public",
      "original": "We make this dedication for the benefit\nof the public at large and to the detriment of our heirs and\nsuccessors.",
      "plain": ["Everyone can use it freely, and with no benefit to us or our children."]
    },
    {
      "id": "overt-relinquishment",
      "original": "We intend this dedication to be an overt act of\nrelinquishment in perpetuity of all present and future rights to this\nsoftware under copyright law.",
      "plain": ["We give up all rights permanently. We want everyone to know we give up our rights to the work now and forever."]
    },
    {
      "id": "filler-jurisdictions",
      "original": "In jurisdictions that recognize copyright laws,",
      "type": "filler"
    },
    {
      "id": "as-is-warranty",
      "original": "THE SOFTWARE IS PROVIDED \"AS IS\", WITHOUT WARRANTY OF ANY KIND,",
      "plain": ["The work is provided \"as is\" with no warranties."]
    },
    {
      "id": "filler-express-implied",
      "original": "EXPRESS OR IMPLIED, INCLUDING BUT NOT LIMITED TO THE WARRANTIES OF\nMERCHANTABILITY, FITNESS FOR A PARTICULAR PURPOSE AND NONINFRINGEMENT.",
      "type": "filler"
    },
    {
      "id": "no-liability",
      "original": "IN NO EVENT SHALL THE AUTHORS BE LIABLE FOR ANY CLAIM, DAMAGES OR\nOTHER LIABILITY,",
      "plain": ["We are not responsible for any problems or damages caused by using the work."]
    },
    {
      "id": "filler-contract-tort",
      "original": "WHETHER IN AN ACTION OF CONTRACT, TORT OR OTHERWISE,",
      "type": "filler"
    },
    {
      "id": "filler-arising-from",
      "original": "ARISING FROM, OUT OF OR IN CONNECTION WITH THE SOFTWARE OR THE USE OR\nOTHER DEALINGS IN THE SOFTWARE.",
      "type": "filler"
    },
    {
      "id": "filler-more-info",
      "original": "For more information, please refer to",
      "type": "filler"
    }
  ]
}
