{
  "$schema": "../../workers/cms-admin/src/schemas/concept-mapping-schema.json",
  "license_id": "MIT",
  "version": "1.0.0",
  "last_updated": "2026-04-05T00:00:00Z",
  "generation_method": "manual",
  "human_reviewed": true,
  "concepts": [
    {
      "id": "permission-grant",
      "original": "Permission is hereby granted, free of charge",
      "plain": ["We give you permission to", "for free"]
    },
    {
      "id": "to-any-person",
      "original": "to any person\nobtaining a copy of this software and associated documentation\nfiles (the \"Software\")",
      "plain": ["Everyone else can do these things too"]
    },
    {
      "id": "deal-without-restriction",
      "original": "to deal in the Software without\nrestriction",
      "plain": ["You can do them for any reason"]
    },
    {
      "id": "filler-hereby",
      "original": "hereby",
      "type": "filler"
    },
    {
      "id": "filler-without-restriction-limitation",
      "original": "without\nrestriction, including without limitation",
      "type": "filler"
    },
    {
      "id": "rights-list",
      "original": "the rights to use,\ncopy, modify, merge, publish, distribute, sublicense, and/or sell\ncopies of the Software",
      "plain": ["We give you permission to"]
    },
    {
      "id": "right-use",
      "original": "use",
      "plain": ["Use it"]
    },
    {
      "id": "right-copy",
      "original": "copy",
      "plain": ["Copy it"]
    },
    {
      "id": "right-modify",
      "original": "modify",
      "plain": ["Change it"]
    },
    {
      "id": "right-merge",
      "original": "merge",
      "plain": ["Mix or put it together with other works"]
    },
    {
      "id": "right-publish",
      "original": "publish",
      "plain": ["Share it"]
    },
    {
      "id": "right-distribute",
      "original": "distribute",
      "plain": ["Share it"]
    },
    {
      "id": "right-sublicense",
      "original": "sublicense",
      "plain": ["Share it"]
    },
    {
      "id": "right-sell",
      "original": "sell\ncopies of the Software",
      "plain": ["Sell it"]
    },
    {
      "id": "permit-others",
      "original": "and to permit persons to whom the\nSoftware is furnished to do so",
      "plain": ["Everyone else can do these things too, as long as they follow these rules"]
    },
    {
      "id": "subject-to-conditions",
      "original": "subject to the following conditions:",
      "plain": ["if you follow these two rules"]
    },
    {
      "id": "copyright-notice-condition",
      "original": "The above copyright notice and this permission notice shall be\nincluded in all copies or substantial portions of the Software.",
      "plain": ["You must keep our copyright notice", "You must also keep this notice with all versions of the work"]
    },
    {
      "id": "as-is-warranty",
      "original": "THE SOFTWARE IS PROVIDED \"AS IS\", WITHOUT WARRANTY OF ANY KIND,",
      "plain": ["We give you the work as it is, with no promises or guarantees", "You get the work exactly how it is"]
    },
    {
      "id": "filler-express-implied",
      "original": "EXPRESS OR IMPLIED,",
      "type": "filler"
    },
    {
      "id": "filler-including-but-not-limited",
      "original": "INCLUDING BUT NOT LIMITED TO",
      "type": "filler"
    },
    {
      "id": "warranty-types",
      "original": "THE WARRANTIES\nOF MERCHANTABILITY, FITNESS FOR A PARTICULAR PURPOSE AND\nNONINFRINGEMENT.",
      "plain": ["We don't promise you can use the work for any specific tasks, or that it won't break any rules"]
    },
    {
      "id": "no-liability",
      "original": "IN NO EVENT SHALL THE AUTHORS OR COPYRIGHT\nHOLDERS BE LIABLE FOR ANY CLAIM, DAMAGES OR OTHER LIABILITY,",
      "plain": ["We are not responsible for any problems or damages that happen because of the work"]
    },
    {
      "id": "filler-contract-tort",
      "original": "WHETHER IN AN ACTION OF CONTRACT, TORT OR OTHERWISE,",
      "type": "filler"
    },
    {
      "id": "filler-arising-from",
      "original": "ARISING\nFROM, OUT OF OR IN CONNECTION WITH",
      "type": "filler"
    },
    {
      "id": "use-at-own-risk",
      "original": "THE USE OR\nOTHER DEALINGS IN THE SOFTWARE.",
      "plain": ["You use it at your own risk"]
    }
  ]
}
